002458560_002507140.wav|she slept all day, and by the time she’d enjoyed an epic hot shower and unpacked her things in the pretty guest bedroom, she felt just about human again.
002507590_002517430.wav|and hungry. she couldn’t even remember the last time she’d eaten, her stomach had been tied up in knots during the flight, and before that . . . some chips from a vending machine, maybe?
002517850_002525170.wav|either way, she needed sustenance, and fast. she pulled on her jeans and a sweater, then headed off into town on foot.
002525350_002534080.wav|it was a bright, blue-skied afternoon, and even though it wasn’t quite summer yet, the sun was faint and warming, and the breeze danced with a salty ocean tang.
002534620_002544160.wav|poppy finally felt herself start to relax. she’d been tense for months, it felt like—with the wedding plans hurtling towards the finish line, and her deadline
002554960_002558740.wav|sweetbriar cove always had a way of making you feel right at home.
002559220_002607620.wav|set in a hollow, mid-way up the cape, sweetbriar had been settled by early english colonists—at least according to the town historical society.
002607800_002613440.wav|she hadn’t been back in twenty years, but poppy was pleased to find everything exactly as she remembered.
002613650_002621570.wav|the winding country lanes lined with old colonial buildings, the green of the town square, and the church spire rising from the top of the hill.
002621750_002628650.wav|she could even swear it was the same flyers advertising the spring fling literary festival peeling in the grocery store window,
002628650_002633000.wav|and the same calico cat perched on a fencepost outside the hardware store.
002633210_002639270.wav|on closer inspection, there were some new improvements—a chic art gallery tucked next to franny’s gift shoppe,
002639270_002646050.wav|a new coffee shop she mentally bookmarked for her morning cup of joe—but the true spirit of sweetbriar was still alive and well.
002658830_002708550.wav|she ducked inside. it was a homey pub, with traditional wooden beams, old black-and-white nautical photographs on the walls, and a big fireplace across the room.
002708880_002717160.wav|she made a beeline for the bar, which was being tended by a scruffy, surfer-looking man with tousled blond hair. “is it really the best on the cape?”
002717340_002727270.wav|she asked, nodding to the menu. “according to big pete,” he said. “and he’s the only authority we need.”, still around?”
002727300_002728710.wav|poppy exclaimed.
002728890_002737680.wav|even she remembered the town mayor, presiding over the fourth of july fireworks with a flourish, decked out in a top and tails printed with the american flag.
002737980_002744970.wav|“still alive and kicking, slower these days,” the man grinned. have to bury him right here in the square.
002745150_002754990.wav|really, i think the town hall voted on it last year.”, poppy laughed, just as a familiar voice came from behind her. “flirting again, riley?
002755140_002804380.wav|you should know, pipsqueak here doesn’t like boys. we’ve all got cooties.”, poppy turned, and found herself staring into cooper’s teasing blue eyes again.
002804620_002813380.wav|she felt a flush—then immediately scolded herself. “only some of them,”, she said with a glare. “and can you please stop calling me that?”
002813650_002823250.wav|“sleep well?”, he asked, undaunted. “no thanks to you.”, she heard a chuckle, and when poppy turned back, she found the bartender looking amused.
002823490_002831590.wav|“friend of yours?”, he asked cooper. “she wouldn’t put it like that,” he said. this is riley,” he introduced them.
002831800_002841640.wav|riley gave her a wink, and cooper let out a snort. “don’t mind the smooth talk,” he told poppy. “he flirts with everything that moves.”, “excellent.”
002841670_002850670.wav|poppy smiled, just to get a rise out of him. “i haven’t flirted with anyone in forever.”, riley smirked.
002850850_002859100.wav|“i like this one. he asked her, and won her undying affection. at least someone had priorities.
002859340_002904380.wav|“all of the above,” poppy answered, and he gave a salute. “coming right up.”
002904500_002912570.wav|riley disappeared in to the back, and cooper slid easily onto the stool beside poppy. “so how’s life as a big-shot romance author?”
002915840_002918660.wav|poppy realized. should have guessed.”
002918780_002928620.wav|she remembered the time her aunt came to visit—and then proceeded to move all her books to the front section of the store, proudly telling everyone within earshot that her niece was the bestseller.
002928800_002938190.wav|poppy loved her enthusiasm, just wished it wasn’t quite so . . . public. “tell me she doesn’t brag too much,” she said, just imagining what the town must think of her.
002938490_002945450.wav|cooper gave her a sideways look. “it depends if you classify sending out a town newsletter about your new book ‘too much.’
002945630_002952770.wav|she told everyone to keep an eye out for you this week. i’m surprised she didn’t make us roll out the ticker-tape and put on a parade.”
002952950_003002550.wav|he tossed another peanut up in a lazy arc and caught it in his mouth. poppy, “so much for keeping a low profile.”, “in hiding, are you?”
003002820_003010020.wav|“something like that.”, she changed the subject fast. “what about you? i can’t believe it’s been so long.
003010230_003019110.wav|the last time i saw you, you were running around dropping seaweed down everyone’s shirts.”, “not everyone,” cooper corrected her. “just yours.”
003019380_003022680.wav|“gee, thanks.”, poppy gave him a sideways look.
003033660_003042900.wav|poppy dragged her gaze away. she shouldn’t be looking at anyone’s muscles, let alone the guy who’d made an art of tormenting her. new with you?”
003042930_003046560.wav|she asked instead. “wife, kids, white picket fence?”
003046980_003056010.wav|the smile slipped from cooper’s face, and poppy had a feeling she’d just said the wrong thing, but before he replied, riley returned with her beer, and another for cooper.
003057390_003107050.wav|she gave him a smile. i probably shouldn’t drink this on an empty stomach.”, riley asked. “the worst,” poppy admitted.
003107320_003116830.wav|“well, just so you know, my place is right upstairs. if you ever can’t make it home.”, riley gave her another wink. cooper grumbled beside her.
003117010_003125740.wav|“c’mon. now you’re just being desperate.”, “i like to think of it more as ‘charming’ and ‘irresistible,’, riley corrected him, and poppy couldn’t help but laugh.
003126010_003132340.wav|“thanks for the offer, but i’ll be sleeping in my own bed,” she said firmly. “for the foreseeable future.”
003132610_003140680.wav|loss,” riley said, unruffled, and headed back towards the kitchen and—poppy hoped—her food. “interesting,” cooper drawled.
003140830_003150400.wav|“the queen of hearts hasn’t found her perfect soulmate yet.”, his words were light enough, but there was a sarcastic note in his voice that made poppy feel like he was mocking her.
003150700_003200120.wav|“not yet, no,” she replied, cooler this time. “yet you figure it’s your job to lecture everyone else on true love,” he said, and took a swig of his beer.
003201140_003210110.wav|don’t you think that’s kind of hypocritical?”, not lecturing anyone.”, poppy frowned, wondering how the conversation had suddenly taken a turn.
003210350_003218900.wav|“people are free to read whatever they want. i just write my stories.”, “full of happy endings and lightning strikes,” cooper challenged.
003219080_003227180.wav|“you ever think you’re setting them all up to fail? chasing after some big happy ending that’s never going to come their way?”, poppy paused.
003227330_003236630.wav|his words hit a nerve deep inside her, the same whispered doubts that kept her up at night, taunting her with the questions she wished she had an answer for. he was wrong.
003236840_003246230.wav|he had to be. otherwise everything she’d spent her life believing was a lie. “what’s it to you?”, she challenged him, trying to keep her cool.
003246410_003256340.wav|she felt weirdly vulnerable, raw wounds open for everyone to see. “have you even read one of my books?”, “i don’t need to,” cooper shrugged.
003256520_003303780.wav|“it’s all the same. building up some fantasyland of love and forever so people can’t help but be let down with the real world.
003303990_003313260.wav|you know, i feel sorry for the suckers who believe it, they don’t even realize what a scam they’re buying into. no offense,” he added, like an afterthought.
003313650_003322530.wav|he had to be kidding. poppy clenched her fists and got down from the stool. “where are you going?”, cooper asked, sounding confused.
003322830_003332670.wav|“well, you’ve just insulted me, my life’s work, and every woman who’s ever bought one of my books, so i figure i better get out of your hair. unless you want to start in on my mom?”
003332700_003340350.wav|poppy demanded. “my pastor? she turned on her heel and stalked across the bar.
003340530_003348690.wav|she would have walked out altogether if she hadn’t been so hungry, but as she sat down at a corner table, she was fuming. what the hell was his problem?
003349020_003355710.wav|she didn’t even know the guy, and he thought he could just dismiss her career as some kind of elaborate con on the readers of america.
003355950_003404260.wav|poppy was used to dealing with snobbery—you didn’t get to write romance without people looking down their noses at you—but,  usually that was easy to brush off.
003415900_003423310.wav|she’d stopped paying attention to those kinds of comments years ago, since she figured nothing would convince them that they were the ones missing out.
003423490_003432730.wav|sure, she wasn’t going to win any literary prizes, but that wasn’t the point. her readers didn’t come to her looking for the real world, they wanted an escape from it.
003432910_003441850.wav|a place to disappear in between school pick-up runs and double shifts at the hospital   a place where fate wasn’t cruel, hope won out, and love was never in vain.
003442300_003447700.wav|a place to believe. so poppy built that world for them—and for herself, too.
003447940_003456430.wav|no matter what else was happening in her life, she could guarantee that everything would work out in the end. at least, it did between the pages of her books.
003456580_003502880.wav|and this year in particular, her writing had been her main escape, as the juggernaut of her wedding barreled on towards “i do.”
003503420_003507230.wav|until the day she looked at her own words and realized if she married owen—if
003507230_003515420.wav|she settled for their life together—she would be giving up on everything she’d told her readers to fight for all these years. did he do this time?”
003515750_003523670.wav|riley’s voice cut through her thoughts, and poppy looked up to find him setting a plate of delicious-looking food in front of her. “sorry, what?”
003523700_003526310.wav|she asked, her mouth already watering.
003528560_003536720.wav|“i just saw him go storming out with a face like thunder, although, that’s just a normal sunday for him.”, poppy pressed her lips together.
003536870_003543230.wav|“just a small disagreement,” she said lightly, and riley snorted. “why am i not surprised?
003543410_003552230.wav|don’t take it personally,” he added with a sympathetic smile. love the guy like a brother, but he can be a grumpy asshole when he sets his mind to it.”
003552530_003600930.wav|“i’ll remember that. thanks, and for the food,” she said. “my pleasure.”, riley turned to go, but then poppy remembered something.
003602220_003609720.wav|i put my foot in it earlier? we were catching up earlier, and i asked cooper if he was married.”, riley looked uneasy.
003609870_003617730.wav|“you’ll have to talk to him about that,” he said, as some new customers came in. “i better go. let me know if you need anything.”
003618240_003627840.wav|poppy watched him walk away. it sounded like she had touched a nerve with cooper without even meaning to, but even so, it didn’t give him the right to tear her down like that.
003628050_003638010.wav|maybe it wasn’t personal for him, but it sure felt that way. enough letting cooper nicholson get under her skin, she decided, and reached for a crisp, thick-cut fry.
003638160_003646860.wav|for some reason, he’d been in her face since the moment she’d arrived, but that didn’t mean she had to let him ruin her day. she was here for a reason, after all.
003647310_003653190.wav|no drama. no conflict. just the happily-ever-after her readers were waiting for.
001929910_001936450.wav| A classic colonial saltbox, it was built in the 1800s and was one of a disappearing breed on the Cape
001508490_001509840.wav|OK, OK
001915420_001917850.wav|He´d had his eye on the house for years
